{
  "schema_version": "1.0.0",
  "blueprint_code": "electrical",
  "name": "Electrical Contractor",
  "vertical": "home-services",
  "description": "Residential and light-commercial electricians; mix of urgent service calls, scheduled installs, and inspection-driven work.",
  "common_services": ["panel_upgrade", "service_call", "ev_charger_install", "lighting", "generator", "rewire", "inspection_repair"],
  "typical_job_types": ["emergency", "scheduled_repair", "estimate_install", "permit_inspection"],
  "seasonal_patterns": ["storm_season_outage_spike", "holiday_lighting", "winter_generator_demand"],
  "default_messaging_tone": "safety-first, licensed-and-insured forward, plainspoken",
  "default_hours": {
    "mon_fri": "07:00-18:00",
    "sat": "08:00-14:00",
    "sun": "emergency_only"
  },
  "recommended_modules": [
    "missed_call_textback",
    "webform_autoreply",
    "speed_to_lead_response",
    "appointment_confirmation",
    "appointment_reminder",
    "estimate_followup",
    "post_job_review_request",
    "overdue_invoice_reminder"
  ],
  "recommended_bundles": ["lead_conversion_pack", "reviews_reputation_pack"],
  "suggested_bundle_order": ["lead_conversion_pack", "scheduling_pack", "reviews_reputation_pack", "billing_collections_pack", "reactivation_pack"],
  "dashboard_kpis": ["first_response_time_p95", "emergency_response_rate", "avg_review_rating", "days_sales_outstanding"],
  "template_overrides": {},
  "status": "spec"
}
